topic,question,options_A,options_B,options_C,options_D,correct_answer,explanation
Fundamentals of Care,A nurse is caring for a patient on strict isolation. Which action ensures proper infection control?,Use clean gloves for all patient contact,Enter the room without personal protective equipment,Reuse gowns for multiple entries,Don full personal protective equipment before entering,D,Donning full personal protective equipment before entering ensures compliance with strict isolation protocols preventing infection transmission.
Fundamentals of Care,A nurse is teaching a patient about incentive spirometry. Which instruction is correct?,Inhale deeply and hold breath for 3-5 seconds,Exhale forcefully into the device,Use the device only once daily,Inhale rapidly to raise the indicator,A,Inhaling deeply and holding the breath for 3-5 seconds promotes lung expansion and prevents postoperative respiratory complications.
Fundamentals of Care,A patient with a new urinary catheter reports bladder spasms. What is the nurse’s first action?,Remove the catheter immediately,Assess for catheter kinking or obstruction,Administer a diuretic to reduce bladder pressure,Flush the catheter with 50 mL saline,B,Assessing for catheter kinking or obstruction identifies the cause of bladder spasms preventing complications.
Fundamentals of Care,A patient with a visual impairment needs assistance with mobility. Which action promotes safety?,Guide the patient by pushing from behind,Allow the patient to walk independently,Offer an arm and describe obstacles,Use a wheelchair for all mobility,C,Offering an arm and describing obstacles promotes safe mobility while maintaining the patient’s independence.
Fundamentals of Care,A nurse is assessing a patient’s oral cavity. Which finding indicates a need for intervention?,White patches on the tongue and cheeks,Pink moist oral mucosa,Symmetrical tongue movement,Intact teeth with no cavities,A,White patches on the tongue and cheeks may indicate oral candidiasis requiring immediate intervention.
Fundamentals of Care,A patient with a feeding tube requires residual volume checks. What is the nurse’s best action if residuals are high?,Continue feeding at the same rate,Hold feeding and notify the provider,Flush the tube with 100 mL water,Administer an antiemetic,B,Holding feeding and notifying the provider prevents complications like aspiration when residual volumes are high.
Fundamentals of Care,A nurse is caring for a patient with a chest tube. Which action prevents complications?,Clamp the tube during transport,Strip the tubing to clear clots,Keep the drainage system above chest level,Ensure the drainage system remains below chest level,D,Keeping the drainage system below chest level prevents backflow and promotes effective drainage reducing complications.
Fundamentals of Care,A patient with postoperative delirium is agitated. Which intervention promotes safety?,Restrain the patient to the bed,Increase environmental stimuli,Provide a calm environment and reorient frequently,Administer a sedative without assessment,C,Providing a calm environment and reorienting frequently reduces agitation and promotes safety in patients with delirium.
Fundamentals of Care,A nurse is teaching a patient about ostomy care. Which instruction prevents skin irritation?,Clean the stoma with mild soap and water,Apply alcohol-based cleanser to the stoma,Change the pouch every 12 hours,Use adhesive tape directly on the skin,A,Cleaning the stoma with mild soap and water prevents skin irritation while maintaining hygiene.
Fundamentals of Care,A patient with a history of falls is admitted. Which intervention minimizes fall risk?,Keep the bed in the highest position,Implement a fall prevention protocol with bed alarms,Encourage independent ambulation,Use restraints during the night,B,Implementing a fall prevention protocol with bed alarms minimizes fall risk while promoting patient safety.
Fundamentals of Care,A nurse is monitoring a patient receiving oxygen via a face mask. Which finding requires immediate action?,Oxygen saturation of 92%,Respiratory rate of 18 breaths per minute,Clear lung sounds bilaterally,Confusion and restlessness,D,Confusion and restlessness may indicate hypoxemia requiring immediate action to assess and adjust oxygen therapy.